,score,content,thumbsUpCount,replyContent
0,5,Face ID and OTP issues : The OTP to create a new billing payee was sent to my email account? Why the sudden change? Furthermore when I get out of the app to retrieve the OTP and get back to the app by switching (I did not turn off the app) the whole app reset and I had to recreate from the beginning when I switched back the “window” on my iOS. Does that mean I now need more than one device to create a new billing organisation payee? Why the huge inconvenience? If I’m outside and have only my phone how can I create a billing organisation payee easily? The Face ID issue was only resolved after I reset the app and had to change my settings back to enable Face ID. Most likely this issue occurred when the app was updated but this is the first time. Not sure what has happened to the quality control and processes that were in place before. Things are not as clear as before.,0,
1,5,"Easy to use & simple to understand : I find that the POSB digibank app is very easy to use and that everything is pretty simple for us users & consumers to understand. Only problem that I feel needs improvement is the duration of how long y'all take to maintain the app, as we users sometimes are promised a fixed timing whereby we can resume using the app, but when we are on the main page of the app, it indicates that the maintenance still isn't over and that causes a lot of problems as we cannot complete, let's say an important transaction that is really urgent and needs to be done as soon as possible. Other than that, I don't think there's any other issues regarding the app. As a whole, a great app and a very useful platform for users & consumers.",0,
2,5,"The best digital banking app in Singapore! : I absolutely love the POSB Digibank app! It has made managing my finances so much easier and convenient. The user interface is clean and intuitive, and I can easily view my account balances and transaction history. The app also has a lot of useful features, such as the ability to transfer money to other accounts and pay bills. I particularly like the fact that I can set up custom notifications to stay on top of my spending. Overall, I highly recommend the POSB Digibank app to anyone who wants a simple and effective way to manage their money.",0,
3,4,"Accessing digital token when logged in. : Well introducing digital token is a great move and I like the fact I can use it without entering otp and that it is a seamless way to make payments. There is one caveat tho - The way the app allows you to access the digital token. Well u can access the token via the splash screen when u on the app. Great! But upon login, the digital token is not accessible or not that I know of after using this feature for almost a year. I find myself in a situation where I have to log out or force close the app and reopening it to access the digital token.  
Sometimes I need to make sure I have funds before I want to make payment but I can’t get the app to either automatically respond to the payment I’m trying to make and there is no way to access digital token when login inside. Hopefully something can be made to resolve this.",0,
4,4,"Payment Controls Monthly Spend Tracking : Under Payment Controls > Monthly Spend Limit, there is a Current Spend tracking. However, as I was told by CSO that this Current Spend follows a monthly cycle that starts on the day that Monthly Spend Limit is toggled on. Let’s say I toggled on the Limit on 13 Feb, this will trigger the Current Spend to start tracking spending from 13 Feb - 12 Mar. Over time I tend not to remember this cycle (when it starts and ends) and the entire spend tracking is rendered meaningless. Wonder if change Limit midway, will it also change the tracking cycle? Hope to see a spend tracking based on calendar month controlled by monthly spend limit.",0,
5,5,"Best bank app in Sg : POSB digibank app is the best banking app in Singapore I’ve used. I have all 3 major bank apps and a few other banks app. Digibank is fast, clear and easy to use. Unlike other banking apps, there is no lag when moving from 1 screen to another 👍🏼
I wish the bank can lead other banks in savings & fixed deposits rates too 😅 There are areas the bank can do better which I will not mention here as it’s not directly related to the app.",0,
6,1,"Bank app causes phone to get very hot within 1min of use : When I start up the app on my new iPhone 12 which I got in Jan 2021, it causes the phone to get very hot within 1 min. The problem became worse when I upgraded to iOS 14.4. After using the bank app, my phone functions will fail (eg I can’t open apps, can’t download mails, can’t sync to iCloud). Upgrading to iOS 14.4.1 did not help either. I have to restart my phone every time these issues occur. The issue recurs again when I use the bank app. It is unsustainable to keep restarting the phone every time I use the bank app. Given how essential a bank app is (now that the app acts as the digital token and physical tokens are phased out by the bank), I hope that both Apple’s and DBS’ teams can work together to resolve this issue.",0,
7,1,"Violates App Store policies : This DBS/POSB banking app blatantly misuses push notification access for the purpose of advertising. App Store policy: 

4.5.4 Push Notifications must not be required for the app to function, and should not be used to send sensitive personal or confidential information. Push Notifications should not be used for promotions or direct marketing purposes unless customers have explicitly opted in to receive them via consent language displayed in your app’s UI, and you provide a method in your app for a user to opt out from receiving such messages. Abuse of these services may result in revocation of your privileges.

This is a word-for-word popup from the app: With app (push) notifications, never miss: 

1. Offers you wish you knew sooner 

2. Protips to spend wisely 

3. Smart insights meant for you. On a banking app, I would definitely want push notifications for security purposes, such as transactions and login or Digital 2FA token notifications. 

However, I can only either accept the marketing spam (promos etc) or not have these important notifications at all.",0,
8,3,"Connection : I’m unable to login when I’m on mobile data, even after clearing of cache, or restart of the iPhone. When attempting to login, it will cause data cut to the other apps too; unless I kill all the apps and switching on/off the airplane mode to re-established a connection with the mobile service. 

Sometimes, almost never, i can log in, but! as i tap on any of my account, it will throw an error message saying “your system encountered a momentary Technical difficulty...” the same error as logging in or any of the area in the app. 

It will only work fine, on wireless connection. Of course, I’m in an open area, full coverage of 4G, and even tried using it during midday afternoon or super late in the midnight. Same result even no peak hour traffic. So i still think its the app. Because i can do every mobile data related to every other app but yours. 

I hope the development team can take a look into this, because its causing a lot of inconveniences.",0,
9,2,"Fix the terrible performance : Every single update says “performance improvements” but every single time I open the app, my phone gets hot and the battery starts going down about 1% per minute. Are POSB mining Bitcoin on our phones?

Because of this, I use the app as little as possible. But giving more than 1 star since it’s still better than UOB’s app.

It would be more usable if we could give nicknames to bill payments, I have 2 accounts with M1 but POSB only lets me identify them by the 9 digit account number so I need to try to remember which is which every time I need to make a manual payment.",0,
10,5,"Posb digibank app lately- not stable : Of late the posb digibank is not stable. It hanged and took a very long time to open. This started last wk and today as well. I had to delete app and reinstalled to get it working.  After reinstalling, it worked for awhile and then the same problem happens again like today. This is so disappointing and I wonder what happened. Please check, thank you",0,
11,1,App affects mobile connection : An app that affects phone mobile connection when used. Mobile connection will stop working when app is used. It will start to connect when app is started and after a while the app will stop responding saying there is an issue with internet connection. Only then user will find the rest of the apps will also stop working as there is no internet connection from the phone.  Workaround is to enable airplane mode and disable it again to bring back the connection. A simple transaction will sometimes require a few of such actions before it can be completed. Really lousy experience.,0,
12,4,"Love this app and if u don’t have it, get it now!! : Best banking app ever, so easy to use once you learn to navigate.
Quick so I can transfer money smoothly without any issues. Honestly a fantastic app and now it’s come with more enhanced features which make me more knowledgeable about my spending and earnings habits. 
Thank you the great app which makes life easier especially with banking. 
Financial health is important to look after to and this app makes it easy with detailed functions and also gives me an overview of everything.",0,
13,4,"Good app, best in the market in terms of functionality. But one basic feature lacking : This is by far the best banking app on the market. The ability to view all my assets and liabilities in one place is very useful. 

Suffice to say, I’ve started investing in DBS’ funds offerings just to keep everything in one place and easily tracked. 

One major gripe I have with DBS, is that the cards spend is not immediately reflected in card’s balance. If you refer to other banking apps, 1 -2 days after making a purchase on the credit card, immediately you’ll find the outstanding balance (not to be confused with statement balance) on the app. Which makes for easy tracking. 

This is the main reason why I’ve used UOB or Amex rather than DBS credit cards. I can’t track my monthly expenditure on a go with ease. 

Perhaps the team should really look into unlocking this feature.",0,
14,4,"To view multiple Accounts : I used to see all my deposit accounts, credit cards accounts in one page but not anymore. Every time I finished doing one transaction & I have to go to the home page, click the down arrow to list all the accounts & view a specify account & back to home page & repeat this step all over again, is not user friendly for this part, overall experience in other transaction via this app are very fast & simple to use.",0,
15,3,Issues with adding apple pay on apple watch : I encountered issues with adding my POSB debit card for apple pay on apple watch. My other back debit card was successfully set up though and I only have 2 cards to add. The messages either show: 1 - Could not add card/Card not added. Contact your card issuer for more information; OR 2 - Apple Pay is unavailable. Try again later. I did reset both my iPhone and apple watch then logged in again but still have the same issues.,0,
16,4,"No option to delete / clear option for Notifications : There has no option to delete/clear option for Notifications after read. It will be much  better able to delte all the notifications which are just for info. 

Appreciate your immediate attention and add the option to delete in the next update. Thanks.",0,
17,2,"Buggy app, a shadow of its former self. : I used to love this app, really enjoyed how seamless banking became with it. However, it appears as though this app is on a decline. 
1. Enable FaceID but it does not work! I still need to enter my PIN to log in. 
2. After entering my PIN, I receive an error message “This service isn’t available now...” and I’ll need to restart the app multiple times before I’m able to log in. 
3. Repeatedly asks me to set up my digital token even though I did it ages ago. 
4. Where is the Comment box for transfers? It is useful as I can inform the other party what the transfer is for.
5. Sometimes, I’m only able to make a transfer once. Attempting a 2nd transfer will result in the above mentioned error message.

This app used to make my banking a breeze, these days I get frustrated while using it. I’ve tried contacting POSB via their website to leave a feedback but I’m unable to find an avenue to do so.",0,
18,1,"Service Not Available poping up : When trying to login, keep poping up Service Not Available. This service issue turned paynow and cashless payment into a hell of a problem. Can’t login meaning all transaction cannot be done. I have to relied on carrying lots of cash again.  

Am an IPhone 14 user. I checked below review and I’m not the only one experiencing this issue. Have to keep refresh the app and at times cannot login means cannot login. I have checked on Wifi/5G/4G and phone is pretty new and experienced this issue island wide. Confirmed is app issue that’s been persistence for more than 2 weeks.",0,
19,4,"Great. Could be better : I like the budgeting feature. I ‘almost’ not using spreadsheet anymore.

It could be improved if when setting up monthly budget, I could also see how much I have budgeted on all categories so I can compare it with my income for the month and make sure I don’t budget too much. This is a no brainer. I ended up setting up my budget first on a spreadsheet  then copying the values to the app.",0,
20,5,"Efficient and hassle free apps : This app gets all the major tasks that we need for our day to day business with banking done quite efficiently. There is no lag and no crash for me this far. However with issues like me wanting to know about the refinancing eligibility and other administrative matters relating to my loan, I hope this app could provide recourse to those options as well.",0,
21,1,"Worst worst app EVER : WHY do I have to log in at least 5 times before the app doesn’t prompt me that I’ve been logged out due to security purposes??? LIKE I’m in an urgent to transfer money from MY OWN ACCOUNT TO MY OWN ACCOUNT or I want to check the details of my previous transactions and ITS IMPOSSIBLE. 

This is so tiring come on you want to be the biggest bank in SEA but the app you make works terrible, probably the most annoying app on my phone right now. Hate this so much and I hate the fact that I can’t change banks right now. Don’t worry I’ll change my bank immediately when I get the chance.",0,
22,1,"World Class Digital Banking Experience? : The statement “deliver world class banking experience” is laughable.

This app is frustrating, especially when and after the IT guys are doing/ are done with their “maintenance”. Sometimes the feeling is like winning the lottery if everything went smoothly.

Numerous times (no joke no exaggeration) have encountered problems where after just 3 or 4 seconds of logging in, a digibank Alert will pop-up saying the session has time-out for my security & to login again. Even after dozens of time trying the same thing happened!!!",0,
23,5,语言 : 如何设置成华语啊,0,
24,5,"POSB/DBS deserves a lot of kudos : I have done business with almost every bank in SG, and POSB/DBS by far has the best customer experience. Great customer service and internet and mobile banking experience. 

None of the other banking apps are comparable to the quality of this app. I also like how the phishing warnings are seamlessly added to the app to warn people of potential phishing scams. Good job DBS!",0,
25,5,"Felicia, the dbs hot line service lady, is very helpful👍👍 : I want to submit some online form, but no idea why the form was not enabled on the dbs website. After call the dbs hotline, it’s solved with the help from Felicia, the hotline service lady. Felicia is very patient and helpful. She guides me step by step for the setup of the digitoken and eventually the website form is enabled. Thanks for the help, Felicia.🙏",0,
26,4,各位大神 : 请问大师 这个应用怎么调成中文？,0,
27,5,"Easy to use :) : Fabulous ease of use for local or overseas transfers, payments and updates. Chat box a little useless and still easier to call the bank hotline for certain issues but this app does most of the stuff I need month-to-month with great ease. Thank you!",0,
28,2,"App does not always work. Most times it just stay at its logo page : When using this and Dbs App, many times it just stay on the main logo and doesn’t move hence can’t carry out transactions. Turn off and on phone. Deleted and download App a few times still same problem since many weeks ago. Currently Using iPhone 8plus and iOS 14.4. Noticed Problem probably started about the time of the last 2nd or 3rd IOS update. Not sure when this App was last updated. Anyway pls sort this out.",0,
29,1,"Tilt : This is my first time writing a review on an app store. Nothing came close to actually prompt me into writing a review but this app is certainly something.

For heaven sake, I had to login to my account more than 3 times because of your “session timeout” 10 seconds into your app. Not to mention how annoying typing on the login preface is. Mind you I’m using the latest update. 

If I have to keep doing this everytime I need to access my bank account, I would prefer to use other convenient means. Please get this check.",0,
30,1,"Was awesome at first, really crappy since a year ago : My fav app hasnt been functioning. Takes a long time to log me in, impossible to transfer money or anything of that sort. I even changed my phone from iPhone10 to iPhone13 thinking it was my old phone causing the issue but no… the problem persists even after multiple deletion and re-installation. If its too hard, might just move my money to UOB or OCBC. It’s embarrassing when you gotta wait 5mins to make a simple paynow transfer at a merchant with a long queue behind you ☹️ .",0,
31,4,"Great app, but need improvements : It’s A Great app and very convenient. Posb can improve few things: in CC section if you to in one cc details and then want to see other one you have to come all the way out to home then click on cc to expand and select next one. Surely can reduce number of taps and simplify it. Similarly there is scope to reduce taps on other account screens.",0,
32,4,"Fulfils banking needs : Great app that fulfils most of my banking needs. Smooth with decent amount of customisation available. Need to work on the digiPortfolio functionality though - app keeps quitting when attempting to navigate through that.

21/09: impossible to report bugs so have to resort to this - app quits when when trying to sync to findex.",0,
33,2,Kept hanging : Was a user friendly app until it hang my entire phone. I can’t even reset my phone. Made me panic and wonder what went wrong as I was doing transfer. Happened twice already. And I don’t even know if the trf went through. I even tried resetting my mobile by pressing the home and on/off keys. But it doesn’t even blink! Then the app itself auto exit. This is scary! Not reliable! I’m avoiding using it as much as I can from now.,0,
34,4,"Please mute the friggin bank transfer / payment sound when the phone is on mute!!! : 1. Please mute the friggin bank transfer / payment sound when the phone is on mute!!!
It is so awkward when people are in a silent room or the library and you had to do a payment.
2. Why is the loading times for the app is so slow until i had to quit the app to load???",0,
35,5,"App showing session timeout immediately after login : I updated my app to latest version and once I login and it is displaying session timeout and asking to relogin 

After I relogin getting same error and looping same process and I cannot able to perform any actions.",0,
36,1,"Phone becomes unresponsive after using the app : As mentioned by a lot of users here, the usage of the app causes the phone to heat up so quickly and the whole phone becomes unresponsive. This happens even after using the app for only less than a minute. As someone who makes use of the digibank services quite frequently, it is very inconvenient for me to keep restarting my phone after each transaction. I sincerely hope the developers would do something about this.",0,
37,1,"App cannot load and stuck at loading screen : Before update to 5.02, cannot get pass loading screen. Complain through many channel, no positive responds. Customer service channel no help at all.

After 5.02, still same problem. Feels like POSB not taking customers seriously, extremely disappointed. Unable to use ibanking app for a few weeks already. My only way to access ibanking account also requires “authentication” from app. Now app cannot use, I am totally stuck. Feels like switching to other more capable banks.",0,
38,3,"3/5 : This app used to be great, it’s easy to navigate and has features to give you insights on your finances. PayNow also easy to use. But the app has been crashing multiple times. Log in for one second -> error message that session has times out -> logged out. And repeat ad nauseam. No point having good features when I can’t even manage to stay logged in..",0,
39,3,"App stuck at opening logo : After the most recent update (Jan 2021), the app is still stuck at the opening logo and would require the user to kill the app using the app switcher and then reopen for it to load properly only the 2nd time onwards. And after some time or later in the day, the same thing has to be done again.

This issue happens on many others’ phones as well. Kindly fix it ASAP",0,
40,5,Payment  control : The payment control allow to have a full control of your credit /debit card in which no bank offer such features in Singapore bank yet .,0,
41,4,"PayNow Contact List : Since IOS 14 there has been a bug with PayNow contact list page. When a contact name is typed in search bar, the search bar ovelaps with the contacts below making it unable to select the top 2 contacts shown on the list. This needs a fix asap !",0,
42,3,"Feedback suggestion : Please let us set the default source of funds in our profile, and remember it. And don’t switch it each time we select another account to do a paynow transfer. E.g every time we login, it will always go back to the default account we set in profile, not the last account we used to do a transfer",0,
43,5,"Transaction History Time Range : Currently, users can only view transaction history of the past 6 months (max). It would be more helpful to allow viewing up to 12 months back.",0,
44,5,"Fantastic app for my favourite bank. : I have not had any major issues from the time I’ve started using this app. Love how it’s a one stop one solution for all my banking needs, which money other banks actually haven’t really tried to implement. Good job POSB. 👍🏽👍🏽",0,
45,5,POSB app page Standstill : This happens almost every time after IOS has been updated . Don’t have this issue since last year where it was working fine for me last few years,0,
46,1,"Blood from ears : Some clown on the developer / ux team insists of having the alert chime PING when we send monet despite the visual being more than adequate. The result - a screeching sound that harms the eardrums way above safe and acceptable levels. It has no threshold - cannot be disabled and is just loud for the sake of it. it’s also obtrusive - everyone gets to hear that one is doing banking.

I recorded the Decibel levels on my Apple Watch and it Alerts a warning. Now imagine how this feels inside the ear?!? This is not just irresponsible - it’s dangerous and needs to be addressed!",0,
47,2,"Frequently facing issues loggin in. : Service not available issue occurring more frequently. Sometimes even after login , immediately getting time out errors. Some other times it throw error saying too many times using wrong pin and ask to reset PIN where only Face ID was used to login. Worst experience of using the world’s best digital bank app. Cannot even support the small SG customer base.",0,
48,5,"Best banking app for credit card : I love the added layers to lock different type of transactions, making it easy to prevent unauthorised one!  I am hoping other bank card has them too!",0,
49,1,"Cards : Please update back on the CARDS section, update to the previous version. Its making me  confuse on the pending thing, previous version was easy for me to track down my expenses. With the new version it get so confusing. Please please remove the pending thingy, i prefer the previous version where i can easily track down my expenses! Prefer the previous version, where it display your expenses accordingly without confusing with the pending thing.",0,
50,3,"Please relook the functions and UX! : Not sure what’s happened but it’s almost impossible to login to the app now... it just hangs and shows the main page for a very long time unlike before. Even after logging off and restarting my phone, it takes forever. OTP sent to email address? Not sure what’s happened. Pls improve the UX. Previously it was so much better, more seamless to use.",0,
51,2,"Causing iPhone 12 Pro temp to go up : Not sure is that only me or anyone else facing the same problem... my new iPhone 12 Pro Max can become very hot when using this app... never happen to my other iPhone before. Was advice my apple help line to delete and re-install, but still having the same problem. So far this is the only app that cause my phone to become very hot... hopefully this can be resolve soon with some coming update..",0,
