,score,content,thumbsUpCount,replyContent
1023,5,"Love the simple design in Financial Plan : I have been using POSB app for my daily purpose and the most advanced feature I liked the most is Financial Plan. They designed to make it more simple and very outstanding. User interface and experience are the key to success. Keep it up guys, you can do it better. #BestBankInWorld",0,
1024,1,"App installed but nowhere to be found : Zero stars for this horrible app

Was forced to download this app because the pervious POSB app stopped working. Even with all the bad reviews I had to download this to use IB but after clicking download, the app was not seen on my phone. Tried to click download again and same thing happened. 

If your newest app is not ready to be used by clients, why do you have to close the previous POSB IB app? This is supposed to be more convenient for clients but it just angers us? Perhaps you should attempt to use this app and ENSURE it works BEFORE releasing it.",0,
1025,5,"Performance Improvement Feedback : Thank you for continuously making progress for a quicker and effortless ibanking.  

Perhaps the next one that should be look into is the balance quick peek and face ID.   After my upgrade to iOS 12.2, i’ve to go login with userid and password the ancient way.",0,
1026,5,Great Improvement! : I'm really impressed with the app. It is much easier to use as compared to the old mBanking app which was too cluttered. Now i'm able to check my balance and transfer funds to other accounts on my phone!,0,
1027,1,"Digital Token isn’t working?! : Want to do some online banking and I have to authenticate via the app but I keep getting the pop up to enable digital token and nothing happens even though I’ve already registered the physical token? I cannot even generate an OTP on the app because it just prompts me to login and takes me to the homepage, and there’s no digital token button anywhere on the interface once you’re logged in. I don’t have the option of getting an OTP through SMS or using the physical token as well. Very frustrating!",0,
1028,1,"Crash : I am using face ID so i can’t key wrong password but still prompt me wrong PW and need to delete the whole app and reinstall again, this happens every 2days or so, since I updated the key token update thing.. this has been on going i have to delete and reinstall even i know and 100% sure that i have the correct password..this has been very inconvenient cause i have accounts that I transfer money in and out from time to time.,please help to check why is this happening",0,
1029,1,语言 : 软件已经出中文了。更新后完全没看见在哪里有中文的。,0,
1030,1,"Great app. Nice waiting game : This is a great app that lags the moment the you open it. After a few seconds, you can start to log in and thereafter you will have to wait because this bank have so many customers. You have to understand that the app not only serves you but others too. So if you can't log in, please try again even though other banks do it better. At POSB, waiting is better. If not why would you use it instead of going down to the dbs/posb ATMs right?",0,
1031,4,Satisfied but suggestion! : Very satisfying experience in the app. The only feature I wish the app provide is being able to check Transaction history for each payee or a particular person that I have transferred in stead of looking back inside the long list of every transactions.,0,
1032,5,Biometric issues was resolved with the latest updates : The biometric issues were fixed and the app is working now very good. I feel much much better as compared to previous versions.,0,
1033,1,"New UI is bad : Still prefer the previous UI. 
Seems that you guys are changing the app for the sake of changing.   Poor layout.  Font is too thin, text is too small hard to read.  Not everyone has a 7 inch screen !
Had to jump through hoops to find a service.  
Where is the card fee waiver ?  It's hidden in the chat bot and had to launch a browser to login again ?? and how do I authenticate when I am in the POSB's app browser ???
What's with the insurance ad on the main page?",0,
1034,5,"A MASSIVE improvement!!! : I don’t usually write reviews for bank apps but I’ve been frustrated with posb digibank’s app for too long.. Until today’s update. Omg, it’s so fast and intuitive. It’s everything a modern bank app should be. Keep improving please, I am LOVING this change!! 5 stars!",0,
1035,5,"Lo & behold : Finally, an app that's thousand times better than the original. Really excited by the work of the IT team and really glad at the work you guys have been doing. Kuddos to those who worked to create this wonderful and interactive app! Cheers!",0,
1036,3,"Great idea but needs improvements : The balance peeking is useful, however that also means other people can gain access to my balance info whenever I hand then my phone, there should be a simple and fast verification to peek the balance like making use of the touch ID.
Touch ID can also be used to replace the token for various transactions.
Great app overall",0,
1037,5,"FaceID & Peek Features are in the Personal Settings ! : Those of you using iOS12.1 - both FaceID and Peek features can be found under Settings > Personal Change (1st item in the menu) ! For those who gave poor ratings, pls check again.",0,
1038,1,"Unstable and a downgrade from previous version.. : Highly unstable after updates. login page timed out for no reason -I just launched the app. Multiple service not available even though it’s touchid. Interface not user friendly as well, I realised. Find it takes a while to find what I’m looking for. The previous version, I was less familiar but figured out intuitively where I could find things. The design is really a downgrade as well.",0,
1039,1,"Unfriendly User Interface : 1. Interface not optimized to iPhone 8plus. Black bars on top and bottom of screen makes the interface look outdated.
2. Functionalities are not as clearly apparent as previous version.
3. Failed digital token authentification when trying to make payments on line. Button to press does not appear in phone app. No other options for one time OTP generation to make payments.

Very disappointed with update. Please rectify soon.",0,
1040,5,Karthik marupaka : It’s really good app for all the workers here from India or Bangladesh or etc coz easy to send money to our families it’s good supporting app all off us please download all you to understand new things in dbs and posb we support them they will support us more,0,
1041,1,"can i use the old version? : i tried to pay other banks credit card once first transaction was done i clicked make another payment, app crashed, ok fine, i relogin again and clocked transfer & pay and chose pay other banks again, then crash again, crashed few times and the app cannot use anymore, i reinstalled twice still the same, the app just cannot use anymore, i clicked Login and nth happen..",0,
1042,1,"Worst banking App : DBS just can’t get this app to do the most important thing which is to allow to login to your account when you are on a desktop or laptop, the digital token which was used to be there although never worked allows you to generate manual OTP, and with the most recent update they completely remove this feature, and I can’t login to my DBS account, this is such a simple thing and they simply can’t do it right!",0,
1043,2,"welcoming change but : we do not need a huge banner that takes up half of screen space every time we log in saying ""welcome to digibank"" that's poor design.

why did you remove the rubber banding effect when you scroll? it's a system wide feature of iOS and disabling it only makes your application inconsistent with other iOS apps.

when I type in the SMS secure pin, why do I need to close the keyboard just because the submit button is hidden behind it? that's poor design. it should be placed on the TOP right hand corner of the token window.

please look at how impressive Apps from other countries especially the US are. Singapore apps pale in comparison",0,
1044,5,"The new interface is pretty : The new interface is pleasant for use. As compared to other banks, the digital functions really can perform most of the transactions and they are seamlessly done.",0,
1045,1,"Very Bad App and unstable at time : Had installed app on a few occasions, after every attempt to synchronised my ID & Pin , after a few days it will not allow me to log in citing digi token setup failed instantly ... IT must do something about it before more will turn to other user friendly Banking App 。Please trace my past records how many time is installed and re-instal again . Before your upgrade all was well , but after that all was a mess",0,
1046,2,"App cannot use : I been using this app for so long. After I update the app and when I want to use it. It’s keep prompting that my phone not connected to internet..?? Using wifi, and even I off and on my phone many times it’s still the same... And it’s not convenient for me to always use my laptop to check my account and transfer..",0,
1047,1,"App keeps saying unable to verify internet connectivity : Cannot log-in in app, keeps saying unable to verify internet connectivity even if all other apps work. Settings checked and Data is on for this app but still the same problem. Uninstalled & installed still the same. Now cannot authenticate transactions because I cannot log-in in app so digital token cannot work. This is frustrating!",0,
1048,5,"Can’t even login : After the latest update, the app cant even allow me to log in, keep receiving the error message Page timeout.",0,
1049,3,"Buggy Lagging : Before update, things will smooth.. from logging in to making transactions will a breeze.. now the app take quite a while to login for iphone SE, took long to process the login and sometimes double login try.. it also look very buggy.. plz do something about it...",0,
1050,1,Irritating .....old app is better than current app : This app is really wasting my time.. When I tap login on my iPhone 6+.. It's not even responds.. No error nothing.. When I see in AppStore there is no updated app... They just added few useful functionalities like Touch ID n quick balance .. But services are always down...what's the point to add new functions which cannot maintain.. Please come up with better quality app with new UX,0,
1051,4,"Request for extra features : The app is currently nice enough. But, of course, it can still be further improved.

I would like to request two new features in the credit card statement listing:
(1) Show the running total of posted payments in the Unbilled Transactions pageview

(2) For transactions in overseas currencies, show the foreign currency amount in the transaction entry

Note that these two features are already available on the desktop webpage view of the same info.",0,
1052,4,"Option to request for a new cheque book : Please consider introducing on this App, an option to request for a new cheque book to be delivered, instead of having to call the branch or customer service. Thank you",0,
1053,5,Love it!! : I really love how it helps to sort out my expenses with the new Financial GPS Tracker features. I finally get to ease my mind where my money goes to. No longer need additional app to manage my money.,0,
1054,5,"Really Nice : Compared with DBS UI, this new DiGi UI is superb. No need to keep moving the page. 

Bit scary abt the UI looks not corp style, but the process is awesome.
 Try to change the WEB UI also like this. 
The new web ui is really F'Off...",0,
1055,1,"Digital token authentication is a fail : Hi POSB, I have failed to authenticate my online session through the app’s digital token feature. I didn’t even receive any notification on my app, and the amazing design means I have to wait for the countdown on the website to finish before I can do anything about it. Please fix this because if I cannot use the digital token authentication feature then I cannot use POSB online banking.",0,
1056,4,Need an update! : Always relied on Touch ID for easier login before I switched my phone. Now it’s a hassle to manually type in everything again. Could Face ID be incorporated into the app as soon as possible please?,0,
1057,5,Works well : I got no idea what happened to the other customers about this app problem but this just works for me 100%.,0,
1058,3,"Activate Overseas Usage of Card : Tried this using both POSB and DBS app. Either I can't agree to the terms and conditions because number pad is blocking (no way to remove the number pad after keying in dates)(DBS app) or I can't limit the usage for a period of time (POSB app) T.T

Have to end up using the computer.",0,
1059,1,"Face ID does not work : Face ID will succeed but the result from the app is “service not available right now.” If try to login through the normal way, will be prompted with timed out error. Every single time. Unable to disable Face ID either; it will give the same message as when you try to login with Face ID. Since the latest update until now, still no fix for this.",0,
1060,5,Simple and easy to use : Simple and easy to use. I think the new feature to see my full account with just a 1 pin login is very cool,0,
1061,3,What happened? : The 'slide and hold' is gone?? Now i need to login in order to look at my bank acc bal. The touch id is gone too! I've seen your ads everywhere - isn't the whole unique selling point of your app the 'slide and hold' and touch id? What happened to them? Pls fix this,0,
1062,2,"Looks better but usability falls short of old app : The old app doesn't look as good but it's much more user friendly. Buttons are big, short cuts are faster. The informational flow is also more logical. Now we have menus and all which gives u a lot more functions bt the steps to get to each function is a lot more!",0,
1063,1,I DONT KNOW WHETHER ANYONE ELSE HAVE THIS SAME PROBLEM : My peek balance is not even on the application itself the fact that after the update it totally disappeared. Well for me its so good at first then it disappeared right after update. What just happened it’s been months i tried to find the setting and all but theres nothing. Please fix this! Hope you read this and somewhat response to it. Thanks~,0,
1064,5,Nice design : Really brings life to the app. Maybe those people that give those review are too rich and wants boring old ui. 10/10 devs good job for this update,0,
1065,1,Motion sickness after use : The new update is not user friendly. Used to see everything in one screen but now need more steps to find different account or credit card balances etc; so cumbersome. Font size too big and interface does not fit phone screen properly (how to change font size?). Options are not well laid out.,0,
1066,2,Please revert back to the old interface : The version before the update was much more user friendly. This new update does not fit my screen and the log in page itself when typing in my name and passcode looks like an iPhone 4 keyboard. App internally was hard to navigate as well.,0,
1067,1,"Unable to access Digital Token : Was told to register for Digital Token so that it’ll be more convenient. 

But now, the Digital Token cannot even be accessed at all. Spoke to Customer Service and was told that this is a common issue and I have to close and reopen the app several times for it to work. Been there and done that, but to no avail.

Seriously, solve this issue so that I can do transactions...",0,
1068,3,"App freezes : Ever since the latest update, when I want to make a transfer to my saved contacts the app freezes and force close itself. Please fix this issue because it’s frustrating. Using an iPhone 6S plus.",0,
1069,4,Massive improvement : Liked the new interface and functionality. Easy access to checking of balance.,0,
1070,2,Digital Token is very unreliable : It takes a very long time for the Digital Token to respond until the Internet Banking website already expires. Authenticating just got stuck. Very unreliable. It should give the user to select SMS or hard token option when digital token is not working accordingly. It’s so frustrating.,0,
1071,5,"In one word Fast,neat and clean : New update is awesome !!! . Neat and clean design provide a refreshing feel. Performance , touch sensitivity and animation are good . This design update i am expecting since last year. Good job dbs.",0,
1072,5,Apple watch app doesnt work anymore : It used to work fine but now it doesn't load my balance. Phone app is perfect.,0,
1073,4,"Touch ID/Face ID and Peek Balance : When I set the Touch ID/Face ID and Peek Balance, after a while this setting will be back to default where I need to enter user name and password.

This app is not stable and sometimes the perk balance will hang too.",0,
1074,1,"Worst update app : Updated app make me irritating, setting I changed Face ID and peek balance after 1 hour all disappear, and re do again and disappear again, updated should be useful here make me irritating and worst update ever... please solve this problem otherwise I will cancel posb account and other bank account....

My Apple Watch also doesn’t work",0,
1075,1,"FingerPrint ID not working : It has been months since the fingerprint ID function has been down. It’s saddening to learn that the very feature that is supposed to be a norm is still not fixed after the app first launch. Can you guys look into this quickly? It has been down for months, not weeks, nor days. Months!",0,
1076,1,"New Update got issue. Do not update!!! : Simply trying to compete with other banks on complicating the app and forgot all about being “easy to use”.

Not easy to use and any new updates will have issues.

Ever since the latest update, I can no longer use my digital token and was asked to wait until 7am before I can perform any transactions.",0,
1077,5,Where is the Paynow option? : I don’t seems to find the paynow option now after the update,0,
1078,1,"Can’t set up digital token and app keeps saying the 6 digit pin from my physical token is invalid : This app isn’t worth 1 star. I can’t do anything with my accounts now, not even checking transaction history, since both digital and physical tokens didn’t work. SMS option to receive 1 time pin is also grayed out in new app. Why? I’m so frustrated now.",0,
1079,1,Problematic : Was left with no option but to download this app. I doubt this app is ready to be used. Probably too many bugs still. Having issues loading the app. Waited for a long while but still unable to login & check my account. So how to check my balance or make any transactions? Please look into this!! Goodness!!,0,
1080,5,"Sleek new design : I just love the new sleek design. It’s also very fast, and the reorganised and improved sections is much better than the previous one. Great job!",0,
1081,5,"Love the new update! : The updated look of digibank is def a lot more sleek and user friendly, a huge improvement from its predecessor. Great job!",0,
1082,2,"Loss of Important Payee’s Names : Hi, I would like to highlight the new update has caused important payee’s names to be lost.

I hope relevant parties can see through this as it is extremely frustrating to be adding all the important payee’s details again (esp bank account), when it doesnt involve 1 but multiple payees. Thank you!",0,
1083,1,Totally incompatible with iOS 11 beta : Don't upgrade to iOS 11 beta if you want to use the posb digibank. Totally incompitable. And no one from Apple or posbank will do anything about it just saying that iOS 11  is a beta release so the app not working is unavoidable. To get it to work you will have to restore back to iOS 10. So don't understand what is this beta release for?,0,
1084,1,"App not working? : I'm no longer able to login with touch ID, everytime I click login it doesn't prompt the touch ID login anymore and I have to login with my user ID and pin. 

Also, the ""Swipe to see balance"" has disappeared. Quite annoying when i need to check my balance. Anyone has this problem? Pls fix it POSB I don't need atas bank outlet.",0,
1085,5,App not working : Unable to login . Loading loading loading,0,
1086,1,"digital token not working : Before the update, the digital token is working fine. After update, prompt to enable digital token. Thinking that it need to set up again but cannot find where to setup. The worse is that, online website always prompt digital token authentication before proceed to anything. Please do something about this error.",0,
1087,1,"New Version - Rubbish : Automatically updated to this new version and cannot make any transaction! The digital token cannot be enabled without any notice or message.

Login on website to make transactions and the mobile one will be forced logout. Urgent transactions need to be done by tonight and don’t know how!!!

DBS, you should publish new version with full testing!",0,
1088,3,Download eStatement not available : I have installed this app hoping I can easily access & download my POSB eStatements. But this app cannot even view my eStatement. I know there's a transaction history but I still want to keep past eStatements for my record purposes.,0,
1089,3,"lag : After the update , i can't even freaking open the app without any facing any issues :-) it just lags & the app just exits itself everytime every single time . :-) love life :-) please fix it :-) im not having it anymore :-) im done :) fix it",0,
1090,4,"New UI’s layout doesn’t scale to my iphone x : Hi i just updated the app today and the new UI is stunning. However the layout doesn’t scale to the screen size. I’m using an iphone x, please fix this!!!!",0,
1091,4,"PayNow Reg : It is tricky to register a PayNow, Customer Service couldn’t help!
Here is what you should do to Reg PayNow. 
1) Login onto your app
2) On the Left side bar you can see PayNow, visible only after login. 
3) Touch onto PayNow and follow the easy steps.",0,
1092,1,"Could not log in : Not even 5 minutes into downloading the app, I already have problem logging in. Tried umpteen times, at least for 20 minutes, still could not login. The error message received was ""experiencing heavy traffic"". Already have a bad feeling about this version. Prefer the old one; mBank.",0,
1093,1,I phone 7plus : Pls work out this app to be compatible to function in I phone 7/7plus. The error always show unable to verify internet connectivity. The instruction given to close the app and check the internet connection. My phone has no problem accessing other app Nor has internet connection problem.,0,
1094,4,"Useful app! : There are more options available in the new app. Personally, I love the touch ID. It saves lots of my time. It will take some times to make this app works perfectly. Chill guys!",0,
1095,2,"Unable to open app : The app was all great and working fine until the recent update. I was unable to open the app at all, despite trying to delete and re-downloading the app again. Tried to go to the app support but not sure where to feedback.",0,
1096,4,"App on Apple Watch : Nice app, love the app. Using Apple Watch, so it's really great to be able to glance & see my outstanding balance, but suddenly showing services not available on Apple Watch, pls fix it.",0,
1097,1,"Horrible : The bank launches a ver 3.0 app without considering the fact that the instructions on internet-banking (web browser) is still the old one. For example, on the site, the steps to generate a digital token is totally irrelevant as it doesn’t the same experience for the app since the app navigation is different now.",0,
1098,1,"App can't open anymore after update : I updated the app on the 18th April and now it doesn't open anymore. It's really frustrating because I can't check my balance and do transfers. everytime I click on the app, it immediately crashes. Help? It can't be my phone because all my other apps work fine.",0,
1099,2,"Unable to load : Able to key in ID and PIN, but the next page does not load - keeps ""loading"", but does not load. How to do transfers & checks without being able to load? Hope posb can fix before the mBanking app is retired in April next week! :)",0,
1100,5,Possibly the best banking app! : I'm jealous that my other banking app are not as neat and informative as this. It seems that POSB / DBS are on the right track to continuously win customer's heart.,0,
1101,1,"Terrible! : The app used to be easy to use and a very efficient way of tracking my finances. All of a sudden, it started to auto log me out of my account when I had just logged in, or glitch and force shut down the whole app, returning me to my phone home screen. Extremely frustrating.",0,
1102,4,"No auto push notifications of funds received : Hi,

Perhaps this is the most important feature still missing to get a 5 Star rating.

Thanks,",0,
1103,1,"Ridiculous : it is ridiculous that I cannot transfer money out or view my transactions just because I do not have my token with me as my house is under renovation thus I do not have my token to sign up for whatever nonsensical update you have. just because I can't sign up, I CANNOT do transactions??? PFFT (and wow you only allow 4 stars to be submitted) SCAM",0,
1104,1,"Help! Can’t login to POSB to do transactions. : Help! The app keeps having this pop-up message “We are unable to verify your internet connectivity. Please close the app, check your network settings and login again.”

I can’t even do any transactions on PayNow! Or view my bank account now that I have switched to digital token!",0,
1105,4,"Reinstall to be TouchID back : I was having error message when using Fingerprint ID function. After reinstalling the apps, the fingerprint ID function is back to normal.",0,
